{
  "artifact_role": "estimator",
  "bundle_path": "30_宏观经济实证Skill/02_模块开发/time-series-dynamics/.artifacts/jel-example5-causal",
  "bundle_ref_id": "rs-bundle-ref-aaaaaaaaaaaaaaaaaaaaaaaaaaaaaaaa",
  "expected_ids": {
    "request_id": "tsd-request-0123456789abcdef",
    "run_id": "tsd-run-47c8f67cbc8772d6b7eb64b7f6db520d"
  },
  "expected_manifest_sha256": "sha256:aaaaaaaaaaaaaaaaaaaaaaaaaaaaaaaaaaaaaaaaaaaaaaaaaaaaaaaaaaaaaaaa",
  "manifest_path": "run-manifest.json",
  "required": true,
  "skill_name": "time-series-dynamics",
  "skill_version": "0.1.0"
}
